#,Attribute Name,Pointbiserial,pvalue < 0.005,Spearman,pvalue < 0.005
1,number of neonatal deaths,0.05113,True,0.01712,False
2,number of infant deaths,0.04837,True,0.01699,False
3,number of under-five deaths,0.04738,True,0.01676,False
4,number of maternal deaths,0.03945,True,0.01828,False
5,mobile cellular subscriptions per 100 people,-0.0311,False,-0.02948,False
6,prevalence of anemia among non-pregnant women pct of women ages 15-49,0.03024,False,0.02527,False
7,prevalence of anemia among women of reproductive age pct of women ages 15-49,0.02982,False,0.02515,False
8,population ages 0-14 female,0.02978,False,0.0147,False
9,population ages 0-14 total,0.02958,False,0.01476,False
10,population ages 0-14 male,0.0294,False,0.01491,False
11,urban population growth annual pct,0.02869,False,0.02496,False
12,employment in services female pct of female employment modeled ilo estimate,-0.02747,False,-0.0243,False
13,food production index 2004-2006 = 100,-0.02703,False,-0.02668,False
14,labor force participation rate male pct of male population ages 15+ modeled ilo estimate,0.02601,False,0.02512,False
15,employment in services pct of total employment modeled ilo estimate,-0.02582,False,-0.02339,False
16,employment to population ratio 15+ male pct modeled ilo estimate,0.02553,False,0.0262,False
17,rural population,0.02551,False,0.01701,False
18,employment in agriculture female pct of female employment modeled ilo estimate,0.02532,False,0.02175,False
19,urban population pct of total,-0.02511,False,-0.0226,False
20,rural population pct of total population,0.02511,False,0.0226,False
21,mortality rate neonatal per 1000 live births,0.02434,False,0.0183,False
22,crop production index 2004-2006 = 100,-0.02378,False,-0.02575,False
23,livestock production index 2004-2006 = 100,-0.02363,False,-0.02577,False
24,employment in agriculture pct of total employment modeled ilo estimate,0.02296,False,0.02035,False
25,employment in services male pct of male employment modeled ilo estimate,-0.02245,False,-0.02177,False
26,employment to population ratio ages 15-24 male pct modeled ilo estimate,0.02224,False,0.01982,False
27,individuals using the internet pct of population,-0.02194,False,-0.02482,False
28,labor force participation rate for ages 15-24 male pct modeled ilo estimate,0.02123,False,0.01751,False
29,rainfall (mm),0.02098,False,0.02355,False
30,prevalence of anemia among children pct of children under 5,0.02071,False,0.01937,False
31,employment in agriculture male pct of male employment modeled ilo estimate,0.02046,False,0.01979,False
32,labor force participation rate male pct of male population ages 15-64 modeled ilo estimate,0.01966,False,0.01955,False
33,permanent cropland pct of land area,0.01946,False,0.01081,False
34,land under cereal production hectares,0.01906,False,0.00915,False
35,vulnerable employment total pct of total employment modeled ilo estimate,0.01871,False,0.01653,False
36,vulnerable employment male pct of male employment modeled ilo estimate,0.01857,False,0.0175,False
37,wage and salaried workers female pct of female employment modeled ilo estimate,-0.01839,False,-0.01593,False
38,self-employed female pct of female employment modeled ilo estimate,0.01839,False,0.01593,False
39,employment to population ratio ages 15-24 total pct modeled ilo estimate,0.01837,False,0.01336,False
40,vulnerable employment female pct of female employment modeled ilo estimate,0.01833,False,0.01647,False
41,wage and salaried workers total pct of total employment modeled ilo estimate,-0.0183,False,-0.0166,False
42,self-employed total pct of total employment modeled ilo estimate,0.0183,False,0.0166,False
43,population ages 10-14 female pct of female population,0.01807,False,0.01796,False
44,population ages 80 and above female pct of female population,-0.01802,False,-0.02014,False
45,population ages 75-79 female pct of female population,-0.01773,False,-0.01751,False
46,population total,0.0177,False,0.01117,False
47,wage and salaried workers male pct of male employment modeled ilo estimate,-0.01769,False,-0.01557,False
48,self-employed male pct of male employment modeled ilo estimate,0.01769,False,0.01557,False
49,population male,0.01768,False,0.01065,False
50,population ages 75-79 male pct of male population,-0.01767,False,-0.01763,False
51,population ages 80 and above male pct of male population,-0.01759,False,-0.01828,False
52,population ages 15-19 female pct of female population,0.01754,False,0.01565,False
53,population ages 5-9 female pct of female population,0.01734,False,0.01959,False
54,population ages 65 and above male pct of total,-0.01728,False,-0.01606,False
55,population ages 65 and above pct of total,-0.01727,False,-0.01631,False
56,population ages 5-9 male pct of male population,0.01721,False,0.01888,False
57,population ages 10-14 male pct of male population,0.01718,False,0.01711,False
58,population female,0.01717,False,0.0106,False
59,population ages 65 and above female pct of total,-0.01712,False,-0.0163,False
60,population ages 55-59 male pct of male population,-0.017,False,-0.01641,False
61,access to electricity rural pct of rural population,-0.01699,False,-0.01893,False
62,population ages 70-74 male pct of male population,-0.01683,False,-0.01607,False
63,population ages 0-14 pct of total,0.01681,False,0.01893,False
64,population ages 0-14 female pct of total,0.01672,False,0.01899,False
65,population ages 55-59 female pct of female population,-0.01666,False,-0.01442,False
66,employment to population ratio 15+ total pct modeled ilo estimate,0.01661,False,0.01229,False
67,age dependency ratio old pct of working-age population,-0.01656,False,-0.01584,False
68,population ages 0-14 male pct of total,0.01653,False,0.01863,False
69,population ages 70-74 female pct of female population,-0.01611,False,-0.01552,False
70,population ages 65-69 male pct of male population,-0.01609,False,-0.01439,False
71,labor force participation rate for ages 15-24 total pct modeled ilo estimate,0.016,False,0.00985,False
72,fixed telephone subscriptions per 100 people,-0.01597,False,-0.01611,False
73,population ages 15-19 male pct of male population,0.01593,False,0.01459,False
74,gdp per person employed constant 2011 ppp  ,-0.01572,False,-0.01754,False
75,population ages 50-54 male pct of male population,-0.01567,False,-0.01555,False
76,arable land pct of land area,0.01556,False,0.00819,False
77,population ages 50-54 female pct of female population,-0.01548,False,-0.01471,False
78,population ages 60-64 male pct of male population,-0.01526,False,-0.01426,False
79,lower secondary school starting age years,-0.01522,False,-0.0182,False
80,population ages 0-4 male pct of male population,0.015,False,0.01855,False
81,population ages 0-4 female pct of female population,0.01484,False,0.01885,False
82,population ages 65-69 female pct of female population,-0.01483,False,-0.01336,False
83,population ages 15-64 male,0.0148,False,0.01048,False
84,population ages 45-49 male pct of male population,-0.01477,False,-0.01516,False
85,lifetime risk of maternal death 1 in  rate varies by country,-0.01461,False,-0.01977,False
86,population ages 15-64 total,0.01458,False,0.01047,False
87,population ages 45-49 female pct of female population,-0.01455,False,-0.01576,False
88,population ages 60-64 female pct of female population,-0.01452,False,-0.0127,False
89,unemployment female pct of female labor force modeled ilo estimate,-0.01451,False,-0.01871,False
90,unemployment youth total pct of total labor force ages 15-24 modeled ilo estimate,-0.0145,False,-0.01668,False
91,unemployment total pct of total labor force modeled ilo estimate,-0.01444,False,-0.01911,False
92,population ages 15-64 female,0.01434,False,0.01022,False
93,unemployment youth female pct of female labor force ages 15-24 modeled ilo estimate,-0.01431,False,-0.01599,False
94,labor force participation rate total pct of total population ages 15+ modeled ilo estimate,0.01428,False,0.00669,False
95,employers male pct of male employment modeled ilo estimate,-0.01418,False,-0.01844,False
96,renewable energy consumption pct of total final energy consumption,0.01413,False,0.01162,False
97,access to electricity pct of population,-0.014,False,-0.01887,False
98,age dependency ratio young pct of working-age population,0.01384,False,0.01893,False
99,life expectancy at birth female years,-0.01379,False,-0.01846,False
100,population ages 20-24 female pct of female population,0.01369,False,0.01383,False
101,mortality rate infant per 1000 live births,0.01347,False,0.01471,False
102,co2 emissions metric tons per capita,-0.01295,False,-0.01673,False
103,unemployment youth male pct of male labor force ages 15-24 modeled ilo estimate,-0.01291,False,-0.01632,False
104,immunization dpt pct of children ages 12-23 months,-0.01289,False,-0.01231,False
105,co2 emissions from solid fuel consumption pct of total,0.01285,False,0.01306,False
106,population ages 15-64 male pct of total,-0.01279,False,-0.01817,False
107,unemployment male pct of male labor force modeled ilo estimate,-0.01277,False,-0.01551,False
108,population ages 20-24 male pct of male population,0.01275,False,0.01466,False
109,primary education duration years,-0.01258,False,-0.01865,False
110,population ages 15-64 pct of total,-0.01235,False,-0.01691,False
111,employment to population ratio ages 15-24 female pct modeled ilo estimate,0.01226,False,0.00704,False
112,life expectancy at birth total years,-0.01207,False,-0.01741,False
113,birth rate crude per 1000 people,0.01198,False,0.01774,False
114,employment in industry male pct of male employment modeled ilo estimate,-0.01189,False,-0.0093,False
115,survival to age 65 female pct of cohort,-0.01175,False,-0.01734,False
116,population ages 15-64 female pct of total,-0.01156,False,-0.01674,False
117,employers total pct of total employment modeled ilo estimate,-0.01127,False,-0.01384,False
118,cereal yield kg per hectare,-0.01118,False,-0.01397,False
119,immunization measles pct of children ages 12-23 months,-0.01104,False,-0.01103,False
120,population ages 40-44 male pct of male population,-0.01101,False,-0.01323,False
121,population growth annual pct,0.01076,False,0.01691,False
122,labor force total,0.01075,False,0.01139,False
123,population ages 40-44 female pct of female population,-0.01057,False,-0.01346,False
124,age dependency ratio pct of working-age population,0.01033,False,0.01684,False
125,life expectancy at birth male years,-0.01014,False,-0.01504,False
126,arable land hectares per person,-0.00997,False,-0.01336,False
127,mortality rate under-5 per 1000 live births,0.00993,False,0.01361,False
128,survival to age 65 male pct of cohort,-0.00979,False,-0.01449,False
129,fertility rate total births per woman,0.00932,False,0.01706,False
130,contributing family workers female pct of female employment modeled ilo estimate,0.00911,False,0.01504,False
131,labor force participation rate for ages 15-24 female pct modeled ilo estimate,0.00886,False,0.00334,False
132,co2 emissions from liquid fuel consumption pct of total,-0.00851,False,-0.0067,False
133,maternal mortality ratio modeled estimate per 100000 live births,0.00848,False,0.01784,False
134,forest area pct of land area,0.00829,False,0.00572,False
135,secondary education duration years,-0.00807,False,-0.00747,False
136,employment in industry female pct of female employment modeled ilo estimate,0.00788,False,0.00469,False
137,population ages 35-39 male pct of male population,-0.00786,False,-0.00917,False
138,renewable electricity output pct of total electricity output,0.00769,False,0.00609,False
139,mortality rate adult female per 1000 female adults,0.00739,False,0.01592,False
140,population ages 35-39 female pct of female population,-0.00733,False,-0.00778,False
141,urban population,0.00728,False,0.00275,False
142,labor force female pct of total labor force,-0.00717,False,-0.00872,False
143,ratio of female to male labor force participation rate pct modeled ilo estimate,-0.00707,False,-0.00719,False
144,population ages 65 and above male,0.00661,False,0.00558,False
145,refugee population by country or territory of origin,-0.0066,False,-0.01075,False
146,natural gas rents pct of gdp,-0.00647,False,-0.00311,False
147,population ages 65 and above total,0.00647,False,0.00528,False
148,population ages 65 and above female,0.00633,False,0.00607,False
149,co2 emissions from gaseous fuel consumption kt,-0.00631,False,-0.00561,False
150,population male pct of total,0.00631,False,0.02628,False
151,population female pct of total,-0.00631,False,-0.02628,False
152,total natural resources rents pct of gdp,-0.00629,False,0.00226,False
153,temparature ($^\circ$c),0.00623,False,0.00552,False
154,employment to population ratio 15+ female pct modeled ilo estimate,0.00606,False,-0.00151,False
155,mortality rate adult male per 1000 male adults,0.00602,False,0.0132,False
156,labor force participation rate total pct of total population ages 15-64 modeled ilo estimate,0.00598,False,-0.00081,False
157,contributing family workers total pct of total employment modeled ilo estimate,0.00595,False,0.01336,False
158,oil rents pct of gdp,-0.00593,False,0.00041,False
159,employment in industry pct of total employment modeled ilo estimate,-0.00566,False,-0.00516,False
160,rural population growth annual pct,0.00539,False,0.00697,False
161,primary school starting age years,-0.00536,False,-0.00629,False
162,mineral rents pct of gdp,-0.00525,False,-0.0064,False
163,adolescent fertility rate births per 1000 women ages 15-19,0.00507,False,0.00652,False
164,population ages 30-34 male pct of male population,-0.00506,False,-0.00417,False
165,mobile cellular subscriptions,-0.00504,False,-0.01088,False
166,co2 emissions from gaseous fuel consumption pct of total,-0.00493,False,-0.0052,False
167,forest area sq. km,-0.00481,False,0.00754,False
168,death rate crude per 1000 people,-0.00478,False,-0.00307,False
169,lifetime risk of maternal death pct,0.00473,False,0.01641,False
170,cereal production metric tons,0.00461,False,0.00676,False
171,contributing family workers male pct of male employment modeled ilo estimate,0.00437,False,0.0121,False
172,employers female pct of female employment modeled ilo estimate,-0.00406,False,-0.00565,False
173,population ages 30-34 female pct of female population,-0.0039,False,-0.0014,False
174,population ages 25-29 female pct of female population,0.00382,False,0.0056,False
175,land area sq. km,-0.00372,False,0.00452,False
176,co2 emissions from liquid fuel consumption kt,-0.00365,False,1e-05,False
177,labor force participation rate female pct of female population ages 15+ modeled ilo estimate,0.00349,False,-0.00334,False
178,surface area sq. km,-0.00328,False,0.004,False
179,energy intensity level of primary energy mj  2011 ppp gdp,0.00301,False,0.0125,False
180,co2 emissions kt,-0.00294,False,0.00248,False
181,coal rents pct of gdp,0.0029,False,0.00464,False
182,fixed telephone subscriptions,-0.00282,False,0.00233,False
183,agricultural land pct of land area,-0.00282,False,-0.00405,False
184,total fisheries production metric tons,-0.00253,False,0.00716,False
185,agricultural land sq. km,-0.00198,False,0.00072,False
186,population density people per sq. km of land area,-0.00191,False,0.01394,False
187,co2 emissions from solid fuel consumption kt,-0.00183,False,0.00541,False
188,population ages 25-29 male pct of male population,0.00175,False,0.00633,False
189,labor force participation rate female pct of female population ages 15-64 modeled ilo estimate,-0.00137,False,-0.00433,False
190,forest rents pct of gdp,0.00105,False,0.01549,False
191,preprimary education duration years,-0.00048,False,-0.00096,False
192,access to electricity urban pct of urban population,-0.00024,False,-0.01781,False
193,capture fisheries production metric tons,-0.00023,False,0.00533,False
