#,Attribute Name,Pointbiserial,pvalue < 0.005,Spearman,pvalue < 0.005
1,employment in industry female pct of female employment modeled ilo estimate,0.03539,True,0.0206,False
2,immunization dpt pct of children ages 12-23 months,-0.02883,False,-0.01891,False
3,immunization measles pct of children ages 12-23 months,-0.02701,False,-0.01904,False
4,access to electricity rural pct of rural population,-0.02644,False,-0.01799,False
5,prevalence of anemia among children pct of children under 5,0.02488,False,0.01929,False
6,unemployment female pct of female labor force modeled ilo estimate,0.02278,False,0.01775,False
7,renewable energy consumption pct of total final energy consumption,0.02232,False,0.01748,False
8,labor force participation rate total pct of total population ages 15-64 modeled ilo estimate,-0.02208,False,-0.01817,False
9,employment in services female pct of female employment modeled ilo estimate,-0.02173,False,-0.01903,False
10,fertility rate total births per woman,0.02165,False,0.01711,False
11,labor force participation rate female pct of female population ages 15-64 modeled ilo estimate,-0.02158,False,-0.01684,False
12,mortality rate neonatal per 1000 live births,0.02156,False,0.01774,False
13,employment to population ratio 15+ female pct modeled ilo estimate,-0.02129,False,-0.01707,False
14,ratio of female to male labor force participation rate pct modeled ilo estimate,-0.02095,False,-0.01659,False
15,employment in services pct of total employment modeled ilo estimate,-0.02075,False,-0.01842,False
16,birth rate crude per 1000 people,0.02043,False,0.01715,False
17,population ages 0-4 female pct of female population,0.02038,False,0.01748,False
18,population ages 0-4 male pct of male population,0.02034,False,0.01743,False
19,co2 emissions from liquid fuel consumption pct of total,0.02025,False,0.01867,False
20,access to electricity pct of population,-0.02009,False,-0.01583,False
21,labor force participation rate female pct of female population ages 15+ modeled ilo estimate,-0.01994,False,-0.01681,False
22,employment in services male pct of male employment modeled ilo estimate,-0.01988,False,-0.01851,False
23,mobile cellular subscriptions per 100 people,-0.01972,False,-0.01992,False
24,employment in agriculture male pct of male employment modeled ilo estimate,0.01959,False,0.01707,False
25,age dependency ratio young pct of working-age population,0.01944,False,0.01693,False
26,age dependency ratio pct of working-age population,0.01937,False,0.01701,False
27,population ages 15-64 female pct of total,-0.01936,False,-0.01701,False
28,secondary education duration years,-0.01918,False,-0.02042,False
29,population ages 15-64 pct of total,-0.01885,False,-0.01701,False
30,population ages 0-14 pct of total,0.01867,False,0.01682,False
31,population ages 0-14 female pct of total,0.01865,False,0.0169,False
32,population ages 0-14 male pct of total,0.01845,False,0.01672,False
33,population ages 15-64 male pct of total,-0.01839,False,-0.01679,False
34,employment to population ratio 15+ total pct modeled ilo estimate,-0.01818,False,-0.01771,False
35,population ages 5-9 female pct of female population,0.0181,False,0.01622,False
36,population ages 5-9 male pct of male population,0.01791,False,0.01608,False
37,mortality rate infant per 1000 live births,0.01789,False,0.01635,False
38,mortality rate under-5 per 1000 live births,0.01779,False,0.01655,False
39,labor force female pct of total labor force,-0.01772,False,-0.0157,False
40,employment in agriculture pct of total employment modeled ilo estimate,0.01756,False,0.01648,False
41,population ages 40-44 female pct of female population,-0.01712,False,-0.0159,False
42,unemployment total pct of total labor force modeled ilo estimate,0.01669,False,0.01747,False
43,life expectancy at birth total years,-0.01667,False,-0.01535,False
44,population ages 45-49 male pct of male population,-0.01665,False,-0.01626,False
45,life expectancy at birth male years,-0.01662,False,-0.01549,False
46,population ages 45-49 female pct of female population,-0.01654,False,-0.01559,False
47,life expectancy at birth female years,-0.01653,False,-0.015,False
48,population ages 40-44 male pct of male population,-0.01638,False,-0.01639,False
49,labor force participation rate total pct of total population ages 15+ modeled ilo estimate,-0.01628,False,-0.01683,False
50,population ages 50-54 male pct of male population,-0.01602,False,-0.01596,False
51,population ages 50-54 female pct of female population,-0.01596,False,-0.01596,False
52,population ages 35-39 female pct of female population,-0.01581,False,-0.01629,False
53,survival to age 65 female pct of cohort,-0.01564,False,-0.01465,False
54,cereal yield kg per hectare,-0.01563,False,-0.02003,False
55,population ages 10-14 female pct of female population,0.01553,False,0.01452,False
56,survival to age 65 male pct of cohort,-0.01534,False,-0.01512,False
57,urban population pct of total,-0.01523,False,-0.01521,False
58,rural population pct of total population,0.01523,False,0.01521,False
59,adolescent fertility rate births per 1000 women ages 15-19,0.01513,False,0.0148,False
60,population ages 10-14 male pct of male population,0.01494,False,0.0136,False
61,lifetime risk of maternal death pct,0.01491,False,0.01606,False
62,maternal mortality ratio modeled estimate per 100000 live births,0.01481,False,0.01571,False
63,individuals using the internet pct of population,-0.01469,False,-0.02049,False
64,population ages 55-59 male pct of male population,-0.01462,False,-0.01652,False
65,population ages 55-59 female pct of female population,-0.01443,False,-0.01606,False
66,population ages 35-39 male pct of male population,-0.01419,False,-0.01641,False
67,employment in industry male pct of male employment modeled ilo estimate,-0.01404,False,-0.01531,False
68,unemployment youth total pct of total labor force ages 15-24 modeled ilo estimate,0.01388,False,0.01582,False
69,employment to population ratio ages 15-24 female pct modeled ilo estimate,-0.01383,False,-0.0158,False
70,access to electricity urban pct of urban population,-0.01382,False,-0.01646,False
71,population ages 15-19 female pct of female population,0.0137,False,0.01591,False
72,fixed telephone subscriptions per 100 people,-0.0137,False,-0.01612,False
73,unemployment youth female pct of female labor force ages 15-24 modeled ilo estimate,0.01328,False,0.01511,False
74,population ages 15-19 male pct of male population,0.01311,False,0.01511,False
75,mortality rate adult male per 1000 male adults,0.0131,False,0.01508,False
76,employment to population ratio ages 15-24 total pct modeled ilo estimate,-0.01308,False,-0.01477,False
77,population ages 60-64 female pct of female population,-0.01305,False,-0.01571,False
78,mortality rate adult female per 1000 female adults,0.01296,False,0.01433,False
79,population ages 60-64 male pct of male population,-0.01289,False,-0.01569,False
80,population ages 65-69 female pct of female population,-0.01284,False,-0.01537,False
81,rural population growth annual pct,0.01278,False,0.0168,False
82,population ages 65-69 male pct of male population,-0.01258,False,-0.01546,False
83,co2 emissions from gaseous fuel consumption pct of total,-0.01255,False,-0.01657,False
84,population ages 70-74 female pct of female population,-0.0125,False,-0.0158,False
85,population ages 70-74 male pct of male population,-0.0124,False,-0.01464,False
86,labor force participation rate for ages 15-24 female pct modeled ilo estimate,-0.01239,False,-0.01474,False
87,population ages 65 and above pct of total,-0.01234,False,-0.01475,False
88,population ages 65 and above female pct of total,-0.01234,False,-0.01591,False
89,population ages 65 and above male pct of total,-0.01228,False,-0.01471,False
90,population ages 75-79 female pct of female population,-0.01223,False,-0.0158,False
91,employment in agriculture female pct of female employment modeled ilo estimate,0.01209,False,0.01355,False
92,refugee population by country or territory of origin,0.01191,False,0.01752,False
93,population ages 75-79 male pct of male population,-0.0119,False,-0.01374,False
94,preprimary education duration years,-0.01173,False,-0.01438,False
95,forest area pct of land area,-0.01154,False,-0.01248,False
96,unemployment male pct of male labor force modeled ilo estimate,0.01146,False,0.01611,False
97,unemployment youth male pct of male labor force ages 15-24 modeled ilo estimate,0.01144,False,0.01565,False
98,co2 emissions metric tons per capita,-0.0114,False,-0.01824,False
99,population ages 80 and above female pct of female population,-0.01127,False,-0.01435,False
100,age dependency ratio old pct of working-age population,-0.01126,False,-0.01402,False
101,population ages 80 and above male pct of male population,-0.01119,False,-0.01364,False
102,labor force participation rate for ages 15-24 total pct modeled ilo estimate,-0.01118,False,-0.01248,False
103,temparature ($^\circ$c),0.01088,False,0.0164,False
104,gdp per person employed constant 2011 ppp  ,-0.01084,False,-0.01153,False
105,co2 emissions from solid fuel consumption pct of total,-0.0107,False,-0.01624,False
106,arable land hectares per person,0.01062,False,0.01726,False
107,population ages 30-34 female pct of female population,-0.01022,False,-0.01392,False
108,employment to population ratio ages 15-24 male pct modeled ilo estimate,-0.00984,False,-0.0107,False
109,population ages 30-34 male pct of male population,-0.00934,False,-0.01516,False
110,contributing family workers female pct of female employment modeled ilo estimate,0.00914,False,0.01103,False
111,renewable electricity output pct of total electricity output,0.00914,False,0.0107,False
112,permanent cropland pct of land area,-0.00902,False,-0.0188,False
113,lifetime risk of maternal death 1 in  rate varies by country,-0.00896,False,-0.01618,False
114,agricultural land pct of land area,0.00896,False,0.0113,False
115,prevalence of anemia among women of reproductive age pct of women ages 15-49,0.00894,False,0.01191,False
116,prevalence of anemia among non-pregnant women pct of women ages 15-49,0.00867,False,0.01194,False
117,death rate crude per 1000 people,0.00859,False,0.01369,False
118,population ages 20-24 female pct of female population,0.00821,False,0.00876,False
119,labor force participation rate male pct of male population ages 15-64 modeled ilo estimate,-0.00808,False,-0.01268,False
120,population growth annual pct,0.00794,False,0.01148,False
121,total natural resources rents pct of gdp,-0.00793,False,-0.01316,False
122,population ages 20-24 male pct of male population,0.00748,False,0.00778,False
123,labor force participation rate for ages 15-24 male pct modeled ilo estimate,-0.00734,False,-0.00898,False
124,arable land pct of land area,-0.00733,False,-0.00753,False
125,contributing family workers male pct of male employment modeled ilo estimate,0.0072,False,0.01227,False
126,self-employed male pct of male employment modeled ilo estimate,0.00682,False,0.00924,False
127,wage and salaried workers male pct of male employment modeled ilo estimate,-0.00682,False,-0.00924,False
128,vulnerable employment male pct of male employment modeled ilo estimate,0.0066,False,0.00941,False
129,wage and salaried workers total pct of total employment modeled ilo estimate,-0.00616,False,-0.00883,False
130,self-employed total pct of total employment modeled ilo estimate,0.00616,False,0.00883,False
131,contributing family workers total pct of total employment modeled ilo estimate,0.00607,False,0.01074,False
132,vulnerable employment total pct of total employment modeled ilo estimate,0.00588,False,0.00836,False
133,capture fisheries production metric tons,-0.00577,False,-0.00975,False
134,wage and salaried workers female pct of female employment modeled ilo estimate,-0.00573,False,-0.00865,False
135,self-employed female pct of female employment modeled ilo estimate,0.00573,False,0.00865,False
136,co2 emissions from liquid fuel consumption kt,-0.00571,False,-0.01228,False
137,vulnerable employment female pct of female employment modeled ilo estimate,0.0057,False,0.00867,False
138,co2 emissions from gaseous fuel consumption kt,-0.00546,False,-0.01659,False
139,rainfall (mm),-0.00538,False,-0.00326,False
140,fixed telephone subscriptions,-0.00505,False,-0.01392,False
141,natural gas rents pct of gdp,-0.00504,False,-0.0152,False
142,cereal production metric tons,-0.00502,False,0.00037,False
143,oil rents pct of gdp,-0.00494,False,-0.00142,False
144,agricultural land sq. km,0.00492,False,0.01237,False
145,population ages 65 and above female,-0.00487,False,-0.00559,False
146,co2 emissions kt,-0.00471,False,-0.01365,False
147,population ages 65 and above total,-0.0047,False,-0.00526,False
148,mobile cellular subscriptions,-0.00469,False,-0.0196,False
149,urban population,-0.00469,False,-0.00159,False
150,forest rents pct of gdp,-0.00464,False,-0.02061,False
151,population ages 65 and above male,-0.00451,False,-0.005,False
152,mineral rents pct of gdp,-0.0043,False,-0.01699,False
153,labor force total,-0.0042,False,-0.00229,False
154,population ages 15-64 female,-0.00419,False,-0.00013,False
155,population ages 15-64 total,-0.00418,False,-3e-05,False
156,population ages 15-64 male,-0.00416,False,-3e-05,False
157,population female,-0.00414,False,0.00088,False
158,population male,-0.00407,False,0.00078,False
159,population total,-0.00396,False,0.00126,False
160,total fisheries production metric tons,-0.0039,False,-0.0106,False
161,primary education duration years,0.00373,False,0.00392,False
162,co2 emissions from solid fuel consumption kt,-0.00373,False,-0.01625,False
163,employment to population ratio 15+ male pct modeled ilo estimate,-0.00372,False,-0.00487,False
164,energy intensity level of primary energy mj  2011 ppp gdp,0.00348,False,0.01334,False
165,livestock production index 2004-2006 = 100,-0.00347,False,-0.0048,False
166,coal rents pct of gdp,-0.00345,False,-0.01133,False
167,population ages 0-14 male,-0.00344,False,0.00667,False
168,population ages 0-14 total,-0.00342,False,0.00668,False
169,population ages 0-14 female,-0.0034,False,0.00682,False
170,population ages 25-29 male pct of male population,-0.00327,False,-0.00404,False
171,food production index 2004-2006 = 100,-0.00327,False,-0.00528,False
172,population density people per sq. km of land area,-0.00327,False,-0.01617,False
173,rural population,-0.00322,False,0.00755,False
174,primary school starting age years,-0.00309,False,-0.00363,False
175,forest area sq. km,-0.00298,False,0.00952,False
176,surface area sq. km,0.00276,False,0.01437,False
177,land area sq. km,0.00261,False,0.01425,False
178,crop production index 2004-2006 = 100,-0.00229,False,-0.00412,False
179,population ages 25-29 female pct of female population,-0.00206,False,-0.00307,False
180,land under cereal production hectares,-0.0018,False,0.00894,False
181,employment in industry pct of total employment modeled ilo estimate,-0.00175,False,-0.0063,False
182,number of maternal deaths,0.00173,False,0.0135,False
183,urban population growth annual pct,0.00165,False,0.00329,False
184,lower secondary school starting age years,0.00149,False,0.0015,False
185,employers male pct of male employment modeled ilo estimate,-0.00128,False,-0.00094,False
186,employers female pct of female employment modeled ilo estimate,-0.00102,False,0.00045,False
187,labor force participation rate male pct of male population ages 15+ modeled ilo estimate,0.00079,False,0.00111,False
188,number of under-five deaths,0.00062,False,0.01298,False
189,employers total pct of total employment modeled ilo estimate,0.00054,False,0.00332,False
190,number of neonatal deaths,-0.0004,False,0.01319,False
191,population female pct of total,2e-05,False,-0.00981,False
192,population male pct of total,-2e-05,False,0.00981,False
193,number of infant deaths,-1e-05,False,0.01289,False
