#,Attribute Name,Pointbiserial,pvalue < 0.005,Spearman,pvalue < 0.005
1,population growth annual pct,-0.05739,True,-0.04195,True
2,refugee population by country or territory of origin,0.04969,True,0.04304,True
3,temparature ($^\circ$c),-0.04061,True,-0.03691,True
4,number of maternal deaths,0.03576,True,0.04124,True
5,number of under-five deaths,0.03124,False,0.04096,True
6,number of infant deaths,0.02982,False,0.04064,True
7,number of neonatal deaths,0.02559,False,0.04044,True
8,agricultural land sq. km,0.0255,False,0.03481,True
9,forest area sq. km,0.02521,False,0.03413,True
10,land under cereal production hectares,0.0224,False,0.03494,True
11,population ages 0-14 female,0.02134,False,0.03942,True
12,population ages 0-14 total,0.02053,False,0.03942,True
13,population ages 0-14 male,0.01981,False,0.03942,True
15,co2 emissions from gaseous fuel consumption kt,0.01537,False,0.03888,True
17,land area sq. km,-0.01466,False,-0.04001,True
19,surface area sq. km,-0.0146,False,-0.04061,True
20,population female,0.01375,False,0.03738,True
21,population male,0.01292,False,0.03808,True
24,population ages 15-64 female,0.01159,False,0.03731,True
25,rural population,0.01151,False,0.03986,True
26,population ages 15-64 total,0.01128,False,0.03737,True
27,urban population,0.01104,False,0.03643,True
28,population ages 15-64 male,0.01098,False,0.03737,True
30,population total,-0.01095,False,-0.04061,True
31,cereal production metric tons,0.01047,False,0.03543,True
32,population ages 65 and above female,0.01044,False,0.03557,True
33,labor force total,0.00985,False,0.03752,True
35,population ages 65 and above total,0.00942,False,0.03621,True
49,population ages 65 and above male,0.00831,False,0.03626,True
87,mobile cellular subscriptions,0.00646,False,0.03549,True
110,co2 emissions kt,0.00516,False,0.0342,True
136,total fisheries production metric tons,0.00384,False,0.03622,True
164,co2 emissions from solid fuel consumption kt,0.00202,False,0.03583,True
180,primary school starting age years,-0.0014,False,0.03507,True
14,rainfall (mm),-0.01649,False,-0.01743,False
16,capture fisheries production metric tons,0.01475,False,0.03175,False
18,mobile cellular subscriptions per 100 people,-0.01461,False,-0.01741,False
22,access to electricity pct of population,0.0122,False,-0.00926,False
23,individuals using the internet pct of population,-0.01176,False,-0.00663,False
29,co2 emissions from liquid fuel consumption kt,0.01095,False,0.0335,False
34,death rate crude per 1000 people,-0.00984,False,-0.00952,False
36,population ages 45-49 male pct of male population,-0.00929,False,-0.01006,False
37,population ages 10-14 male pct of male population,0.00924,False,0.0089,False
38,population ages 50-54 male pct of male population,-0.00905,False,-0.00846,False
39,population ages 10-14 female pct of female population,0.00896,False,0.00854,False
40,cereal yield kg per hectare,-0.00895,False,-0.00842,False
41,population ages 45-49 female pct of female population,-0.00894,False,-0.0108,False
42,life expectancy at birth female years,-0.00885,False,-0.02192,False
43,life expectancy at birth total years,-0.00878,False,-0.02174,False
44,population ages 15-19 male pct of male population,0.00868,False,0.00204,False
45,population ages 50-54 female pct of female population,-0.00864,False,-0.00592,False
46,population ages 5-9 male pct of male population,0.00858,False,0.01339,False
47,life expectancy at birth male years,-0.00856,False,-0.0198,False
48,population ages 15-19 female pct of female population,0.00834,False,0.00185,False
50,population ages 40-44 female pct of female population,-0.00826,False,-0.01317,False
51,population ages 55-59 male pct of male population,-0.00825,False,-0.00351,False
52,mortality rate neonatal per 1000 live births,0.00821,False,0.02026,False
53,population ages 5-9 female pct of female population,0.00816,False,0.01402,False
54,population ages 0-14 male pct of total,0.00809,False,0.01441,False
55,population ages 40-44 male pct of male population,-0.00805,False,-0.01186,False
56,population ages 0-14 pct of total,0.00797,False,0.01419,False
57,survival to age 65 male pct of cohort,-0.00782,False,-0.01637,False
58,livestock production index 2004-2006 = 100,-0.00777,False,-0.01074,False
59,population ages 0-14 female pct of total,0.00773,False,0.01373,False
60,population ages 80 and above male pct of male population,-0.00773,False,0.00233,False
61,employment in services pct of total employment modeled ilo estimate,-0.00767,False,-0.01131,False
62,population ages 15-64 female pct of total,-0.00759,False,-0.02123,False
63,employment in services male pct of male employment modeled ilo estimate,-0.00757,False,-0.01206,False
64,population ages 55-59 female pct of female population,-0.00755,False,-0.00192,False
65,population ages 15-64 pct of total,-0.00752,False,-0.02,False
66,employment in services female pct of female employment modeled ilo estimate,-0.00746,False,-0.00986,False
67,population ages 15-64 male pct of total,-0.00738,False,-0.01874,False
68,age dependency ratio young pct of working-age population,0.00737,False,0.01852,False
69,lifetime risk of maternal death 1 in  rate varies by country,-0.00732,False,0.00664,False
70,prevalence of anemia among children pct of children under 5,0.00732,False,0.02009,False
71,food production index 2004-2006 = 100,-0.00731,False,-0.01181,False
72,population ages 20-24 male pct of male population,0.00717,False,0.0024,False
73,employment in agriculture male pct of male employment modeled ilo estimate,0.00712,False,0.01399,False
74,employment in agriculture pct of total employment modeled ilo estimate,0.00709,False,0.01327,False
75,age dependency ratio pct of working-age population,0.00708,False,0.02134,False
76,population ages 80 and above female pct of female population,-0.00704,False,0.00611,False
77,population ages 60-64 male pct of male population,-0.00704,False,0.0007,False
78,prevalence of anemia among non-pregnant women pct of women ages 15-49,0.00703,False,0.01637,False
79,prevalence of anemia among women of reproductive age pct of women ages 15-49,0.00697,False,0.01646,False
80,mortality rate adult male per 1000 male adults,0.00696,False,0.01778,False
81,population ages 75-79 male pct of male population,-0.00694,False,0.00145,False
82,employment in agriculture female pct of female employment modeled ilo estimate,0.00676,False,0.01295,False
83,population ages 0-4 male pct of male population,0.0067,False,0.01749,False
84,population ages 65 and above male pct of total,-0.00654,False,0.00107,False
85,population ages 35-39 female pct of female population,-0.00652,False,-0.01076,False
86,co2 emissions from liquid fuel consumption pct of total,0.00651,False,0.01107,False
88,gdp per person employed constant 2011 ppp  ,-0.00645,False,0.00156,False
89,mortality rate infant per 1000 live births,0.00643,False,0.02121,False
90,rural population pct of total population,0.00643,False,0.00894,False
91,urban population pct of total,-0.00643,False,-0.00894,False
92,population ages 20-24 female pct of female population,0.00639,False,-0.0024,False
93,population ages 0-4 female pct of female population,0.00639,False,0.01539,False
94,population ages 70-74 male pct of male population,-0.00629,False,0.00073,False
95,access to electricity urban pct of urban population,0.00627,False,-0.01985,False
96,unemployment total pct of total labor force modeled ilo estimate,0.00617,False,0.0196,False
97,population ages 60-64 female pct of female population,-0.00616,False,0.00199,False
98,survival to age 65 female pct of cohort,-0.0061,False,-0.0203,False
99,population ages 65 and above pct of total,-0.00596,False,0.00308,False
100,population ages 35-39 male pct of male population,-0.00588,False,-0.01191,False
101,labor force participation rate total pct of total population ages 15-64 modeled ilo estimate,-0.00564,False,-0.01267,False
102,population ages 65 and above female pct of total,-0.00557,False,0.00503,False
103,population ages 75-79 female pct of female population,-0.00546,False,0.00451,False
104,unemployment female pct of female labor force modeled ilo estimate,0.00544,False,0.02212,False
105,mortality rate adult female per 1000 female adults,0.00543,False,0.02103,False
106,fixed telephone subscriptions per 100 people,-0.00539,False,0.00243,False
107,age dependency ratio old pct of working-age population,-0.00536,False,0.00639,False
108,mortality rate under-5 per 1000 live births,0.00517,False,0.02219,False
109,permanent cropland pct of land area,0.00517,False,0.02302,False
111,crop production index 2004-2006 = 100,-0.00512,False,-0.00922,False
112,contributing family workers male pct of male employment modeled ilo estimate,0.00511,False,0.01708,False
113,population ages 65-69 male pct of male population,-0.00509,False,0.00117,False
114,access to electricity rural pct of rural population,-0.00499,False,-0.02012,False
115,fixed telephone subscriptions,0.00492,False,0.0329,False
116,unemployment male pct of male labor force modeled ilo estimate,0.00482,False,0.01476,False
117,population ages 70-74 female pct of female population,-0.00471,False,0.00313,False
118,vulnerable employment male pct of male employment modeled ilo estimate,0.00467,False,0.01267,False
119,employment in industry male pct of male employment modeled ilo estimate,-0.00454,False,-0.00913,False
120,self-employed male pct of male employment modeled ilo estimate,0.00453,False,0.01256,False
121,wage and salaried workers male pct of male employment modeled ilo estimate,-0.00453,False,-0.01256,False
122,rural population growth annual pct,0.00448,False,0.00613,False
123,contributing family workers total pct of total employment modeled ilo estimate,0.00444,False,0.01598,False
124,labor force participation rate female pct of female population ages 15-64 modeled ilo estimate,-0.0044,False,-0.01208,False
125,natural gas rents pct of gdp,0.0044,False,0.02859,False
126,vulnerable employment total pct of total employment modeled ilo estimate,0.00424,False,0.01106,False
127,self-employed total pct of total employment modeled ilo estimate,0.00423,False,0.01065,False
128,wage and salaried workers total pct of total employment modeled ilo estimate,-0.00423,False,-0.01065,False
129,employment to population ratio 15+ total pct modeled ilo estimate,-0.00422,False,-0.00643,False
130,labor force participation rate male pct of male population ages 15-64 modeled ilo estimate,-0.00401,False,-0.01382,False
131,contributing family workers female pct of female employment modeled ilo estimate,0.00398,False,0.01693,False
132,co2 emissions from solid fuel consumption pct of total,-0.00395,False,0.00506,False
133,population ages 65-69 female pct of female population,-0.00392,False,0.00265,False
134,employment to population ratio 15+ female pct modeled ilo estimate,-0.00386,False,-0.01117,False
135,employment to population ratio ages 15-24 female pct modeled ilo estimate,-0.00384,False,0.00084,False
137,wage and salaried workers female pct of female employment modeled ilo estimate,-0.00381,False,-0.00776,False
138,self-employed female pct of female employment modeled ilo estimate,0.00381,False,0.00776,False
139,maternal mortality ratio modeled estimate per 100000 live births,0.00376,False,0.02358,False
140,vulnerable employment female pct of female employment modeled ilo estimate,0.0037,False,0.00748,False
141,population density people per sq. km of land area,-0.00365,False,0.02235,False
142,energy intensity level of primary energy mj  2011 ppp gdp,0.00347,False,0.02219,False
143,co2 emissions metric tons per capita,-0.00341,False,0.00422,False
144,adolescent fertility rate births per 1000 women ages 15-19,0.00327,False,0.0149,False
145,labor force participation rate for ages 15-24 female pct modeled ilo estimate,-0.00324,False,-0.00254,False
146,unemployment youth total pct of total labor force ages 15-24 modeled ilo estimate,0.00319,False,0.01154,False
147,unemployment youth female pct of female labor force ages 15-24 modeled ilo estimate,0.00309,False,0.01484,False
148,lower secondary school starting age years,-0.00309,False,-0.02674,False
149,employers male pct of male employment modeled ilo estimate,-0.00296,False,-0.00295,False
150,labor force participation rate total pct of total population ages 15+ modeled ilo estimate,-0.00295,False,-0.00286,False
151,labor force participation rate female pct of female population ages 15+ modeled ilo estimate,-0.00294,False,-0.0087,False
152,ratio of female to male labor force participation rate pct modeled ilo estimate,-0.00278,False,-0.01116,False
153,arable land pct of land area,-0.00274,False,0.00945,False
154,lifetime risk of maternal death pct,0.00272,False,0.02565,False
155,employment in industry female pct of female employment modeled ilo estimate,0.00259,False,0.01049,False
156,coal rents pct of gdp,-0.00258,False,0.02716,False
157,employment in industry pct of total employment modeled ilo estimate,-0.00253,False,-0.00947,False
158,agricultural land pct of land area,-0.0025,False,-0.00446,False
159,co2 emissions from gaseous fuel consumption pct of total,-0.00241,False,0.00329,False
160,immunization dpt pct of children ages 12-23 months,-0.00231,False,-0.01984,False
161,unemployment youth male pct of male labor force ages 15-24 modeled ilo estimate,0.00222,False,0.00987,False
162,immunization measles pct of children ages 12-23 months,-0.00218,False,-0.01841,False
163,employment to population ratio ages 15-24 total pct modeled ilo estimate,-0.00212,False,-0.00369,False
165,employment to population ratio 15+ male pct modeled ilo estimate,-0.00201,False,-0.00469,False
166,population ages 30-34 female pct of female population,-0.00199,False,0.00132,False
167,renewable electricity output pct of total electricity output,-0.00195,False,0.00935,False
168,primary education duration years,-0.00193,False,-0.03261,False
169,labor force female pct of total labor force,-0.00191,False,-0.01812,False
170,total natural resources rents pct of gdp,-0.00189,False,0.01439,False
171,oil rents pct of gdp,-0.00182,False,0.02673,False
172,population ages 30-34 male pct of male population,-0.00181,False,0.00192,False
173,preprimary education duration years,0.00177,False,-0.01717,False
174,employers total pct of total employment modeled ilo estimate,-0.00175,False,-0.00032,False
175,arable land hectares per person,-0.00174,False,0.0109,False
176,population male pct of total,-0.00172,False,0.01158,False
177,population female pct of total,0.00172,False,-0.01158,False
178,employers female pct of female employment modeled ilo estimate,0.00147,False,0.00602,False
179,population ages 25-29 female pct of female population,0.00147,False,0.00315,False
181,birth rate crude per 1000 people,0.00138,False,0.01146,False
182,population ages 25-29 male pct of male population,0.00137,False,0.00578,False
183,labor force participation rate for ages 15-24 male pct modeled ilo estimate,0.00132,False,-0.00197,False
184,labor force participation rate for ages 15-24 total pct modeled ilo estimate,-0.00132,False,-0.00156,False
185,urban population growth annual pct,-0.0012,False,0.00133,False
186,mineral rents pct of gdp,-0.00105,False,0.02673,False
187,forest rents pct of gdp,0.00038,False,0.02728,False
188,labor force participation rate male pct of male population ages 15+ modeled ilo estimate,-0.00038,False,-0.00069,False
189,secondary education duration years,-0.00037,False,0.01513,False
190,forest area pct of land area,0.0003,False,0.0011,False
191,fertility rate total births per woman,-0.00028,False,0.01501,False
192,employment to population ratio ages 15-24 male pct modeled ilo estimate,0.00026,False,-0.0023,False
193,renewable energy consumption pct of total final energy consumption,0.00026,False,0.0116,False
